{
  "schemaVersion": 1,
  "lessonId": "M01-L001",
  "title": "M01-L001 — Survival Thai 01: First 10 Minutes in Thailand",
  "sections": [
    {
      "heading": "What you will be able to say after this lesson",
      "body": [
        "Handle first-contact interactions politely using survival phrases and correct PTM-adapted transliteration with inline tone marks."
      ]
    },
    {
      "heading": "Core phrases (Thai / Transliteration / English)",
      "body": [
        "สวัสดี | sà-wàt-dii | hello",
        "ขอบคุณ | khàawp-khun | thank you",
        "ครับ | khráp | male polite ending",
        "ค่ะ | khâ | female statement ending",
        "คะ | khá | female question ending",
        "ขอโทษ | khǎaw-thôot | excuse me / sorry",
        "ไม่เข้าใจ | mâi khâo-jai | I do not understand",
        "พูดช้าๆ ได้ไหม | phûut cháa-cháa dâai mái | can you speak slowly?"
      ]
    },
    {
      "heading": "Teaching notes and explanation cues",
      "body": [
        "Core greeting stack: Teach pragmatic greeting and gratitude with politeness particles.",
        "Start with สวัสดี sà-wàt-dii.",
        "Then add ครับ khráp or ค่ะ khâ depending on speaker role.",
        "Repair + clarity: Recover conversation when comprehension drops.",
        "Use ขอโทษ khǎaw-thôot to interrupt politely.",
        "Follow with ไม่เข้าใจ mâi khâo-jai.",
        "Speed control request: Request slower speech without breaking politeness.",
        "พูดช้าๆ ได้ไหม phûut cháa-cháa dâai mái means can you speak slowly?",
        "Add ครับ or คะ for tone and politeness."
      ]
    },
    {
      "heading": "Mini dialogues / role-play",
      "body": [
        "Staff: สวัสดีค่ะ | sà-wàt-dii khâ | Hello.",
        "Learner: ขอโทษครับ พูดช้าๆ ได้ไหมครับ | khǎaw-thôot khráp phûut cháa-cháa dâai mái khráp | Excuse me, can you speak slowly?",
        "Staff: ได้ค่ะ | dâai khâ | Sure.",
        "Learner: ขอบคุณครับ | khàawp-khun khráp | Thank you."
      ]
    },
    {
      "heading": "Practice drills (self-study)",
      "body": [
        "Say สวัสดีครับ three times slowly.",
        "Switch to female form: สวัสดีค่ะ.",
        "Role drill: ขอโทษครับ ไม่เข้าใจครับ",
        "Repeat in female form with ค่ะ.",
        "Slow repetition at 60% speed.",
        "Swap endings: ...ไหมครับ / ...ไหมคะ"
      ]
    },
    {
      "heading": "Vocabulary list for review / flashcards",
      "body": [
        "สวัสดี | sà-wàt-dii | hello",
        "ขอบคุณ | khàawp-khun | thank you",
        "ครับ | khráp | male polite ending",
        "ค่ะ | khâ | female statement ending",
        "คะ | khá | female question ending",
        "ขอโทษ | khǎaw-thôot | excuse me / sorry",
        "ไม่เข้าใจ | mâi khâo-jai | I do not understand",
        "พูดช้าๆ ได้ไหม | phûut cháa-cháa dâai mái | can you speak slowly?"
      ]
    },
    {
      "heading": "Quick recap + memory aids",
      "body": [
        "Greet first.",
        "Use particles correctly.",
        "Repair with ขอโทษ and ไม่เข้าใจ.",
        "Request slower speed politely."
      ]
    }
  ],
  "drills": [
    "Say สวัสดีครับ three times slowly.",
    "Switch to female form: สวัสดีค่ะ.",
    "Role drill: ขอโทษครับ ไม่เข้าใจครับ",
    "Repeat in female form with ค่ะ.",
    "Slow repetition at 60% speed.",
    "Swap endings: ...ไหมครับ / ...ไหมคะ"
  ],
  "answerKey": [
    "Use PTM inline transliteration marks in every practice line.",
    "Greet first.",
    "Use particles correctly.",
    "Repair with ขอโทษ and ไม่เข้าใจ.",
    "Request slower speed politely."
  ]
}
