{
  "schemaVersion": 1,
  "lessonId": "M01-L002",
  "title": "M01-L002 — Names and Countries — Introducing Yourself",
  "sections": [
    {
      "heading": "What you will be able to say after this lesson",
      "body": [
        "Target runtime: 10-13 minutes",
        "Scenario: You meet a new Thai person at a café or co-working space. You need to introduce yourself, ask their name, and share where you are from.",
        "Learner takeaway: By the end, you can introduce yourself with your name and country of origin in a natural 3–4 line Thai exchange."
      ]
    },
    {
      "heading": "Core phrases (Thai / Transliteration / English)",
      "body": [
        "ชื่อ | chûue | name",
        "อะไร | à-rai | what",
        "คุณชื่ออะไร | khun chûue à-rai | what is your name?",
        "คน | khon | person",
        "ผมชื่อ... | phǒm chûue... | my name is... (male speaker)",
        "ฉันชื่อ... | chǎn chûue... | my name is... (female speaker)",
        "มาจาก | maa-jàak | come from",
        "ประเทศ | bprà-thêet | country",
        "มาจากประเทศ... | maa-jàak bprà-thêet... | come from (country)...",
        "ไทย | thai | Thailand / Thai",
        "อังกฤษ | ang-grìt | England / English",
        "อเมริกา | à-mee-rí-kaa | America",
        "ประเทศ | bprà-thêet | country (pronunciation focus)"
      ]
    },
    {
      "heading": "Teaching notes and explanation cues",
      "body": [
        "Your name in Thai: Teach ชื่อ (name) and อะไร (what) as individual words, then combine them into the question chunk คุณชื่ออะไร (what is your name?).",
        "Let's start with two words you will use every time you meet someone new in Thailand.",
        "First word: ชื่อ chûue. Listen first. ชื่อ. This means 'name'. Say it with me: ชื่อ. Notice the falling tone — your voice starts high and drops.",
        "Say your name: Teach คน (person) individually, then teach the response pattern ผม/ฉันชื่อ... (my name is...) and drill name introductions.",
        "Now you can ask a name. But you need to answer too. First, one more new word.",
        "คน khon. Listen first. คน. This means 'person'. Say it with me: คน. You will hear this word everywhere in Thai — คนไทย means Thai person, คนอังกฤษ means English person. For now, just know คน means person.",
        "Where you come from: Teach มาจาก (come from) and ประเทศ (country) individually, then combine into the origin pattern มาจากประเทศ... (come from country...).",
        "Now you can say your name. Next: where you come from.",
        "First word: มาจาก maa-jàak. Listen first. มาจาก. This means 'come from'. Say it with me: มาจาก. It is two parts — มา means come, จาก means from — but learn it as one unit: come from.",
        "Thailand, England, and America: Teach ไทย (Thailand), อังกฤษ (England), and อเมริกา (America) individually, then use them in full origin sentences with the pattern from section 3.",
        "You have the pattern. Now let's fill it with country names.",
        "First country: ไทย thai. Listen first. ไทย. This means Thailand or Thai. Say it with me: ไทย. Mid tone — keep your voice flat and even. Easy.",
        "Pronunciation: the bp sound: Train the learner to hear and produce the unaspirated bp/bpr sound in ประเทศ, contrasting it with the aspirated ph sound.",
        "Let's train your mouth on a new Thai sound. You heard ประเทศ bprà-thêet earlier. That bpr at the start is tricky for English speakers.",
        "In English, you always add a puff of air to p — like in 'pot'. Thai has two kinds of p-sound. One with air: ph, like in ผม phǒm. One without air: bp, like in ประเทศ bprà-thêet."
      ]
    },
    {
      "heading": "Mini dialogues / role-play",
      "body": [
        "You: สวัสดีครับ | sà-wàt-dii khráp | Hello.",
        "New person: สวัสดีค่ะ | sà-wàt-dii khâ | Hello.",
        "You: ผมชื่อ Mark ครับ คุณชื่ออะไรครับ | phǒm chûue Mark khráp khun chûue à-rai khráp | My name is Mark. What is your name?",
        "New person: ฉันชื่อ Nine ค่ะ คุณมาจากประเทศอะไรคะ | chǎn chûue Nine khâ khun maa-jàak bprà-thêet à-rai khá | My name is Nine. What country are you from?",
        "You: ผมมาจากประเทศอังกฤษครับ | phǒm maa-jàak bprà-thêet ang-grìt khráp | I come from England.",
        "New person: คนอังกฤษคะ | khon ang-grìt khá | An English person?",
        "You: ใช่ครับ ผมเป็นคนอังกฤษครับ | châi khráp phǒm bpen khon ang-grìt khráp | Yes, I am English.",
        "New person: ฉันเป็นคนไทยค่ะ | chǎn bpen khon thai khâ | I am Thai.",
        "You: ขอบคุณครับ | khàawp-khun khráp | Thank you."
      ]
    },
    {
      "heading": "Practice drills (self-study)",
      "body": [
        "Listen and repeat: ชื่อ chûue. Again. Now อะไร à-rai. Again. Now the full question: คุณชื่ออะไร.",
        "Pause-and-produce: I want to ask someone their name politely. Say the full question with ครับ or คะ before I show the answer.",
        "Tone echo: ชื่อ has a falling tone — voice goes high then drops. Say ชื่อ three times, exaggerating the fall each time.",
        "Response-building: I ask คุณชื่ออะไรครับ — now you answer with your real name using ผมชื่อ or ฉันชื่อ. Say it aloud.",
        "Substitution drill: say ผมชื่อ Nine ครับ. Now replace Nine with your own name. Now say it with ฉัน and ค่ะ instead.",
        "Pause-and-produce: someone asks you คุณชื่ออะไร — what do you say? Answer before I show it.",
        "Listen and repeat: มาจาก. Again. ประเทศ. Again. มาจากประเทศ. Again.",
        "Substitution drill: say มาจากประเทศ slowly. Now say ผมมาจากประเทศ with ครับ. Now say ฉันมาจากประเทศ with ค่ะ.",
        "Pause-and-produce: how do you say 'come from country'? Say it before I show the answer. มาจากประเทศ.",
        "Listen and repeat: ไทย, อังกฤษ, อเมริกา. Say each one twice.",
        "Substitution drill: say ผมมาจากประเทศไทยครับ. Now swap ไทย for อังกฤษ. Now swap for อเมริกา.",
        "Pause-and-produce: what is 'Thai person' in Thai? Say it. Now 'English person'. Now 'American person'.",
        "Tone echo: say ประเทศ bprà-thêet three times. Focus on keeping the bp without an air puff.",
        "Minimal pair choice: I say two words — bpàa and phâa. Which one is forest and which is cloth? Point before I tell you."
      ]
    },
    {
      "heading": "Vocabulary list for review / flashcards",
      "body": [
        "ชื่อ | chûue | name",
        "อะไร | à-rai | what",
        "คุณชื่ออะไร | khun chûue à-rai | what is your name?",
        "คน | khon | person",
        "ผมชื่อ... | phǒm chûue... | my name is... (male speaker)",
        "ฉันชื่อ... | chǎn chûue... | my name is... (female speaker)",
        "มาจาก | maa-jàak | come from",
        "ประเทศ | bprà-thêet | country",
        "มาจากประเทศ... | maa-jàak bprà-thêet... | come from (country)...",
        "ไทย | thai | Thailand / Thai",
        "อังกฤษ | ang-grìt | England / English",
        "อเมริกา | à-mee-rí-kaa | America",
        "ประเทศ | bprà-thêet | country (pronunciation focus)"
      ]
    },
    {
      "heading": "Quick recap + memory aids",
      "body": [
        "How do you ask someone's name in Thai? Say it now.",
        "Say 'my name is...' using your real name.",
        "How do you say 'I come from America'?",
        "What does คนไทย mean?",
        "What is the difference between bp and ph sounds?"
      ]
    }
  ],
  "drills": [
    "Listen and repeat: ชื่อ chûue. Again. Now อะไร à-rai. Again. Now the full question: คุณชื่ออะไร.",
    "Pause-and-produce: I want to ask someone their name politely. Say the full question with ครับ or คะ before I show the answer.",
    "Tone echo: ชื่อ has a falling tone — voice goes high then drops. Say ชื่อ three times, exaggerating the fall each time.",
    "Response-building: I ask คุณชื่ออะไรครับ — now you answer with your real name using ผมชื่อ or ฉันชื่อ. Say it aloud.",
    "Substitution drill: say ผมชื่อ Nine ครับ. Now replace Nine with your own name. Now say it with ฉัน and ค่ะ instead.",
    "Pause-and-produce: someone asks you คุณชื่ออะไร — what do you say? Answer before I show it.",
    "Listen and repeat: มาจาก. Again. ประเทศ. Again. มาจากประเทศ. Again.",
    "Substitution drill: say มาจากประเทศ slowly. Now say ผมมาจากประเทศ with ครับ. Now say ฉันมาจากประเทศ with ค่ะ.",
    "Pause-and-produce: how do you say 'come from country'? Say it before I show the answer. มาจากประเทศ.",
    "Listen and repeat: ไทย, อังกฤษ, อเมริกา. Say each one twice.",
    "Substitution drill: say ผมมาจากประเทศไทยครับ. Now swap ไทย for อังกฤษ. Now swap for อเมริกา.",
    "Pause-and-produce: what is 'Thai person' in Thai? Say it. Now 'English person'. Now 'American person'.",
    "Tone echo: say ประเทศ bprà-thêet three times. Focus on keeping the bp without an air puff.",
    "Minimal pair choice: I say two words — bpàa and phâa. Which one is forest and which is cloth? Point before I tell you."
  ],
  "answerKey": [
    "Use PTM inline transliteration marks in every practice line.",
    "How do you ask someone's name in Thai? Say it now.",
    "Say 'my name is...' using your real name.",
    "How do you say 'I come from America'?",
    "What does คนไทย mean?",
    "What is the difference between bp and ph sounds?"
  ]
}
