{
  "schemaVersion": 1,
  "lessonId": "M01-L003",
  "title": "M01-L003 — Pronouns and Who Questions",
  "sections": [
    {
      "heading": "What you will be able to say after this lesson",
      "body": [
        "Target runtime: 10-13 minutes",
        "Scenario: You are at a small gathering and need to introduce someone, ask who another person is, and confirm identities politely.",
        "Learner takeaway: By the end, you can say I, you, he/she, introduce someone with 'this is...', and ask 'who is that?' in Thai."
      ]
    },
    {
      "heading": "Core phrases (Thai / Transliteration / English)",
      "body": [
        "ฉัน | chǎn | I (female / neutral)",
        "ผม | phǒm | I (male polite)",
        "คุณ | khun | you (polite)",
        "เขา | khǎo | he / she",
        "นี่ | nîi | this",
        "คือ | khuu | is",
        "นี่คือ... | nîi khuu... | this is...",
        "ใคร | khrai | who",
        "เขาคือใคร | khǎo khuu khrai | who is he/she?",
        "คุณคือ...ใช่ไหม | khun khuu... châi mái | you are... right?",
        "ฉัน | chǎn | I (rising tone)"
      ]
    },
    {
      "heading": "Teaching notes and explanation cues",
      "body": [
        "Two ways to say I: Teach ฉัน and ผม individually as the two ways to say 'I' in Thai, then drill choosing the right one.",
        "In English, everyone says 'I'. In Thai, you choose which 'I' to use. Let's learn both.",
        "Listen first. ฉัน chǎn. This means 'I'. Female speakers use ฉัน in everyday conversation. Say it with me: ฉัน.",
        "Talking about you and someone else: Teach คุณ and เขา individually, then drill using all four pronouns in short sentences.",
        "You know how to say 'I'. Now let's add 'you' and 'he' or 'she'.",
        "Listen first. คุณ khun. This means 'you'. It is polite and safe in any situation. Say it with me: คุณ.",
        "This is... — introducing someone: Teach นี่ and คือ individually, then combine into the chunk นี่คือ... for making introductions.",
        "Now you can say I, you, and he/she. Let's learn to introduce someone: 'This is...'",
        "Listen first. นี่ nîi. This means 'this'. You use it when pointing to something or someone close by. Say it with me: นี่.",
        "Who is that? — asking identity questions: Teach ใคร individually, then combine into เขาคือใคร and คุณคือ...ใช่ไหม for asking and confirming identity.",
        "You can introduce someone with นี่คือ. But what if you want to ask who someone is?",
        "Listen first. ใคร khrai. This means 'who'. Say it with me: ใคร.",
        "Pronunciation: rising tones in pronouns: Train the ear on the rising tone that appears in ฉัน, ผม, and เขา, with a minimal pair contrast.",
        "Three of today's pronouns share the same tone. Listen: ฉัน chǎn, ผม phǒm, เขา khǎo. Can you hear it? They all rise up at the end. This is the rising tone.",
        "The rising tone starts low and lifts up, like you are asking a question in English. Try it: chǎn. Your voice dips down then goes up. Again: phǒm. Again: khǎo."
      ]
    },
    {
      "heading": "Mini dialogues / role-play",
      "body": [
        "You: ขอโทษครับ เขาคือใคร | khǎaw-thôot khráp khǎo khuu khrai | Excuse me, who is he/she?",
        "Friend: นี่คือคุณนิค่ะ | nîi khuu khun ní khâ | This is Khun Ni.",
        "You: คุณคือคุณนิใช่ไหมครับ | khun khuu khun ní châi mái khráp | You are Khun Ni, right?",
        "Friend: ใช่ค่ะ | châi khâ | Yes.",
        "You: สวัสดีครับ ผมชื่อมาร์คครับ | sà-wàt-dii khráp phǒm chûue máak khráp | Hello, my name is Mark.",
        "Friend: สวัสดีค่ะ คุณมาจากประเทศอะไรคะ | sà-wàt-dii khâ khun maa-jàak bprà-thêet à-rai khá | Hello, what country are you from?",
        "You: ผมมาจากประเทศอังกฤษครับ | phǒm maa-jàak bprà-thêet ang-grìt khráp | I am from England.",
        "Friend: คุณมาจากประเทศอังกฤษใช่ไหมคะ | khun maa-jàak bprà-thêet ang-grìt châi mái khá | You are from England, right?",
        "You: ใช่ครับ ขอบคุณครับ | châi khráp khàawp-khun khráp | Yes. Thank you."
      ]
    },
    {
      "heading": "Practice drills (self-study)",
      "body": [
        "Listen and repeat: ฉัน chǎn. Again. ผม phǒm. Again.",
        "Choose the right 'I': I describe a speaker. Say ฉัน or ผม before I show the answer. Male teacher introducing himself? Your turn. Female student talking about herself? Your turn.",
        "Substitution drill: say 'my name is...' using ผม first — ผมชื่อ... Now switch to ฉัน — ฉันชื่อ...",
        "Listen and repeat: คุณ khun. เขา khǎo. Again faster.",
        "Response-building: I point to someone and ask คุณชื่ออะไร. Pause and answer with ฉันชื่อ... or ผมชื่อ... using your real name.",
        "Substitution drill: say 'his/her name is...' — เขาชื่อ... Try it with three different names.",
        "Listen and repeat: นี่ nîi. คือ khuu. นี่คือ nîi khuu.",
        "Substitution drill: I give you a word, you build the introduction. เพื่อน — say นี่คือเพื่อน. คนไทย — say นี่คือคนไทย. คุณนิ — say นี่คือคุณนิ.",
        "Pause-and-produce: I point to someone. Say 'this is...' in Thai before I show the answer. Your turn.",
        "Listen and repeat: ใคร khrai. เขาคือใคร khǎo khuu khrai. คุณคือ...ใช่ไหม khun khuu... châi mái.",
        "Response-building: I point to a person. Ask เขาคือใคร. I answer. Then confirm with คุณคือ...ใช่ไหม. Build the full exchange.",
        "Substitution drill: ask 'who is he/she?' — เขาคือใคร. Now confirm identity: คุณคือคุณนิใช่ไหม. Try with another name: คุณคือคุณมาร์คใช่ไหม.",
        "Tone echo: I say ฉัน chǎn. Repeat it. Now ผม phǒm. Repeat. Now เขา khǎo. Repeat. Feel the rise.",
        "Minimal pair choice: I say two words — khun and khǎo. Which one is 'you' and which is 'he/she'? Point to the answer."
      ]
    },
    {
      "heading": "Vocabulary list for review / flashcards",
      "body": [
        "ฉัน | chǎn | I (female / neutral)",
        "ผม | phǒm | I (male polite)",
        "คุณ | khun | you (polite)",
        "เขา | khǎo | he / she",
        "นี่ | nîi | this",
        "คือ | khuu | is",
        "นี่คือ... | nîi khuu... | this is...",
        "ใคร | khrai | who",
        "เขาคือใคร | khǎo khuu khrai | who is he/she?",
        "คุณคือ...ใช่ไหม | khun khuu... châi mái | you are... right?",
        "ฉัน | chǎn | I (rising tone)"
      ]
    },
    {
      "heading": "Quick recap + memory aids",
      "body": [
        "How do you say 'I' as a male speaker? Say it before looking.",
        "Point to someone and say 'who is he?' in Thai.",
        "Introduce a friend: say 'this is Khun Ni' in Thai.",
        "Confirm identity: say 'you are Khun Mark, right?' in Thai.",
        "What word means 'this'? And what word means 'is'?"
      ]
    }
  ],
  "drills": [
    "Listen and repeat: ฉัน chǎn. Again. ผม phǒm. Again.",
    "Choose the right 'I': I describe a speaker. Say ฉัน or ผม before I show the answer. Male teacher introducing himself? Your turn. Female student talking about herself? Your turn.",
    "Substitution drill: say 'my name is...' using ผม first — ผมชื่อ... Now switch to ฉัน — ฉันชื่อ...",
    "Listen and repeat: คุณ khun. เขา khǎo. Again faster.",
    "Response-building: I point to someone and ask คุณชื่ออะไร. Pause and answer with ฉันชื่อ... or ผมชื่อ... using your real name.",
    "Substitution drill: say 'his/her name is...' — เขาชื่อ... Try it with three different names.",
    "Listen and repeat: นี่ nîi. คือ khuu. นี่คือ nîi khuu.",
    "Substitution drill: I give you a word, you build the introduction. เพื่อน — say นี่คือเพื่อน. คนไทย — say นี่คือคนไทย. คุณนิ — say นี่คือคุณนิ.",
    "Pause-and-produce: I point to someone. Say 'this is...' in Thai before I show the answer. Your turn.",
    "Listen and repeat: ใคร khrai. เขาคือใคร khǎo khuu khrai. คุณคือ...ใช่ไหม khun khuu... châi mái.",
    "Response-building: I point to a person. Ask เขาคือใคร. I answer. Then confirm with คุณคือ...ใช่ไหม. Build the full exchange.",
    "Substitution drill: ask 'who is he/she?' — เขาคือใคร. Now confirm identity: คุณคือคุณนิใช่ไหม. Try with another name: คุณคือคุณมาร์คใช่ไหม.",
    "Tone echo: I say ฉัน chǎn. Repeat it. Now ผม phǒm. Repeat. Now เขา khǎo. Repeat. Feel the rise.",
    "Minimal pair choice: I say two words — khun and khǎo. Which one is 'you' and which is 'he/she'? Point to the answer."
  ],
  "answerKey": [
    "Use PTM inline transliteration marks in every practice line.",
    "How do you say 'I' as a male speaker? Say it before looking.",
    "Point to someone and say 'who is he?' in Thai.",
    "Introduce a friend: say 'this is Khun Ni' in Thai.",
    "Confirm identity: say 'you are Khun Mark, right?' in Thai.",
    "What word means 'this'? And what word means 'is'?"
  ]
}
